{"api_key_env":"WORLD_BUILDER_API_KEY","contract_version":"0.1.0","endpoint":"https://yourapi/v1/chat/completions","limits":{"attempts":3,"max_calls":128,"max_output_tokens":16000,"max_parts":12000,"max_response_bytes":2000000,"max_sites":32,"max_total_tokens":1000000,"max_voxels":20000000,"review_rounds":2,"timeout_s":90,"wall_time_s":1800,"workers":3},"model":"yourapi","protocol":"chat_completions","response_format":"json_object","stage_models":{"A":"yourapi","B":"yourapi","C":"yourapi","D":"yourapi","E":"yourapi","F":"yourapi"},"token_parameter":"max_completion_tokens"}